[
  {"schema_version":"1.0","contribution_id":"fictional-01","consent":{"granted":true,"notice_version":"1.0"},"metrics":{"setup_time_seconds":210,"stale_decision_reuse_prevented":true,"verification_consistent":true,"verification_succeeded":true,"willingness_to_pay":"yes"}},
  {"schema_version":"1.0","contribution_id":"fictional-02","consent":{"granted":true,"notice_version":"1.0"},"metrics":{"setup_time_seconds":240,"stale_decision_reuse_prevented":false,"verification_consistent":true,"verification_succeeded":true,"willingness_to_pay":"unsure"}},
  {"schema_version":"1.0","contribution_id":"fictional-03","consent":{"granted":true,"notice_version":"1.0"},"metrics":{"setup_time_seconds":180,"stale_decision_reuse_prevented":true,"verification_consistent":true,"verification_succeeded":true,"willingness_to_pay":"yes"}},
  {"schema_version":"1.0","contribution_id":"fictional-04","consent":{"granted":true,"notice_version":"1.0"},"metrics":{"setup_time_seconds":300,"stale_decision_reuse_prevented":false,"verification_consistent":true,"verification_succeeded":true,"willingness_to_pay":"no"}},
  {"schema_version":"1.0","contribution_id":"fictional-05","consent":{"granted":true,"notice_version":"1.0"},"metrics":{"setup_time_seconds":270,"stale_decision_reuse_prevented":true,"verification_consistent":true,"verification_succeeded":true,"willingness_to_pay":"yes"}},
  {"schema_version":"1.0","contribution_id":"fictional-06","consent":{"granted":true,"notice_version":"1.0"},"metrics":{"setup_time_seconds":195,"stale_decision_reuse_prevented":false,"verification_consistent":true,"verification_succeeded":true,"willingness_to_pay":"unsure"}},
  {"schema_version":"1.0","contribution_id":"fictional-07","consent":{"granted":true,"notice_version":"1.0"},"metrics":{"setup_time_seconds":225,"stale_decision_reuse_prevented":true,"verification_consistent":true,"verification_succeeded":true,"willingness_to_pay":"yes"}},
  {"schema_version":"1.0","contribution_id":"fictional-08","consent":{"granted":true,"notice_version":"1.0"},"metrics":{"setup_time_seconds":255,"stale_decision_reuse_prevented":false,"verification_consistent":true,"verification_succeeded":true,"willingness_to_pay":"declined"}},
  {"schema_version":"1.0","contribution_id":"fictional-09","consent":{"granted":true,"notice_version":"1.0"},"metrics":{"setup_time_seconds":285,"stale_decision_reuse_prevented":true,"verification_consistent":true,"verification_succeeded":true,"willingness_to_pay":"yes"}},
  {"schema_version":"1.0","contribution_id":"fictional-10","consent":{"granted":true,"notice_version":"1.0"},"metrics":{"setup_time_seconds":165,"stale_decision_reuse_prevented":false,"verification_consistent":true,"verification_succeeded":true,"willingness_to_pay":"no"}}
]
